{
  "$schema": "https://json-schema.org/draft/2020-12/schema",
  "$id": "https://grominet95.github.io/jarvis-skills/schemas/index.schema.json",
  "title": "Jarvis Skills — index.json",
  "description": "Schéma de validation de l'index global du catalogue jarvis-skills. Reflète exactement la structure produite par build_index.py (trois tableaux distincts).",
  "type": "object",
  "required": ["version", "updated_at", "skills", "presets", "views"],
  "additionalProperties": false,
  "properties": {
    "version": {
      "type": "string",
      "description": "Version du format d'index (ex: \"2.0\")"
    },
    "updated_at": {
      "type": "string",
      "format": "date",
      "description": "Date de dernière mise à jour au format ISO 8601 (YYYY-MM-DD)"
    },
    "skills": {
      "type": "array",
      "description": "Skills conversationnels",
      "items": { "$ref": "#/$defs/skill_entry" }
    },
    "presets": {
      "type": "array",
      "description": "Skills de type preset",
      "items": { "$ref": "#/$defs/preset_entry" }
    },
    "views": {
      "type": "array",
      "description": "Vues frontend",
      "items": { "$ref": "#/$defs/view_entry" }
    }
  },
  "$defs": {
    "base_entry": {
      "type": "object",
      "required": ["name", "version", "author", "description", "tags", "path"],
      "properties": {
        "name": {
          "type": "string",
          "pattern": "^[a-z0-9]+(-[a-z0-9]+)*$"
        },
        "version": {
          "type": "string",
          "pattern": "^(0|[1-9]\\d*)\\.(0|[1-9]\\d*)\\.(0|[1-9]\\d*)$"
        },
        "author": { "type": "string", "minLength": 1 },
        "description": { "type": "string", "minLength": 1 },
        "tags": {
          "type": "array",
          "items": { "type": "string" },
          "minItems": 1
        },
        "path": { "type": "string", "minLength": 1 }
      }
    },
    "skill_entry": {
      "allOf": [
        { "$ref": "#/$defs/base_entry" },
        {
          "required": ["type", "requires_env", "requires_tools", "requires_oauth", "requires_apps", "capabilities", "platforms"],
          "properties": {
            "type": { "const": "conversational" },
            "requires_env": { "type": "array", "items": { "type": "string" } },
            "requires_tools": { "type": "array", "items": { "type": "string" } },
            "requires_oauth": { "type": "array", "items": { "type": "string" } },
            "requires_apps": { "type": "array", "items": { "type": "string" } },
            "capabilities": { "type": "array", "items": { "type": "string" }, "minItems": 1, "maxItems": 6 },
            "platforms": { "type": "array", "items": { "enum": ["mac", "windows", "linux"] }, "minItems": 1 }
          }
        }
      ]
    },
    "preset_entry": {
      "allOf": [
        { "$ref": "#/$defs/base_entry" },
        {
          "required": ["type", "triggers", "requires_env", "requires_tools", "requires_oauth", "requires_apps", "capabilities", "platforms"],
          "properties": {
            "type": { "const": "preset" },
            "triggers": { "type": "array", "items": { "type": "string" }, "minItems": 1 },
            "requires_env": { "type": "array", "items": { "type": "string" } },
            "requires_tools": { "type": "array", "items": { "type": "string" } },
            "requires_oauth": { "type": "array", "items": { "type": "string" } },
            "requires_apps": { "type": "array", "items": { "type": "string" } },
            "capabilities": { "type": "array", "items": { "type": "string" }, "minItems": 1, "maxItems": 6 },
            "platforms": { "type": "array", "items": { "enum": ["mac", "windows", "linux"] }, "minItems": 1 }
          }
        }
      ]
    },
    "view_entry": {
      "allOf": [
        { "$ref": "#/$defs/base_entry" },
        {
          "required": ["requires_tools", "requires_env"],
          "properties": {
            "static_files": { "type": "array", "items": { "type": "string" } },
            "requires_tools": { "type": "array", "items": { "type": "string" } },
            "requires_env": { "type": "array", "items": { "type": "string" } }
          }
        }
      ]
    }
  }
}
